Davison R.M.; Martinsons M.G.; Wong L.H.M.,The ethics of action research participation,2022,Information Systems Journal,21,14,"Action research (AR) involves one or more researchers and a client organisation. Many guidelines for and reports of the research method have been published. However, the ethical issues associated with AR have been largely neglected. Our review of the AR literature found that ethical dilemmas and their resolution are rarely and inconsistently reported. Stimulated by this neglect and our personal experiences, we aim to raise awareness and understanding about the ethics of planning, conducting and reporting AR. We identify and discuss four issues of concern that merit specific ethical attention when conducting AR: collaboration, competence, persistence and consent. We draw on these four issues in an analysis that augments the principles and criteria for canonical AR (CAR), recently reified as Integrated Action Research (IAR). Our guidance includes an additional principle of AR and 10 associated criteria to address the ethics of AR participation. © 2021 John Wiley & Sons Ltd.","Department of Information Systems, City University of Hong Kong, Kowloon, Hong Kong; Department of Management, City University of Hong Kong, Kowloon, Hong Kong; NUCB Business School, Nagoya University of Commerce & Business, Japan",action research; ethics; research collaboration; research consent; research method; research principles,Information systems; Action research; Ethical dilemma; Ethical issues; Personal experience; Principles and criterion; research methods; Philosophical aspects,Research opinion,Article,IS discipline,Disciplinary,Global,Normative,Deontology; consequentlialism; virtue ethics,Conceptual analysis,Methodological,Research,0,0,0,1,Subjectivism; Relativism; Cognitivism,Implicit
Giermindl L.M.; Strich F.; Christ O.; Leicht-Deobald U.; Redzepi A.,The dark sides of people analytics: reviewing the perils for organisations and employees,2022,European Journal of Information Systems,25,175,"Technological advances in the field of artificial intelligence (AI) are heralding a new era of analytics and data-driven decision-making. Organisations increasingly rely on people analytics to optimise human resource management practices in areas such as recruitment, performance evaluation, personnel development, health and retention management. Recent progress in the field of AI and ever-increasing volumes of digital data have raised expectations and contributed to a very positive image of people analytics. However, transferring and applying the efficiency-driven logic of analytics to manage humans carries numerous risks, challenges, and ethical implications. Based on a theorising review our paper analyses perils that can emerge from the use of people analytics. By disclosing the underlying assumptions of people analytics and offering a perspective on current and future technological advancements, we identify six perils and discuss their implications for organisations and employees. Then, we illustrate how these perils may aggravate with increasing analytical power of people analytics, and we suggest directions for future research. Our theorising review contributes to information system research at the intersection of analytics, artificial intelligence, and human-algorithmic management. © 2021 The Author(s). Published by Informa UK Limited, trading as Taylor & Francis Group.","School of Business, OST Eastern Switzerland University of Applied Sciences, St. Gallen, Switzerland; Chair of Human Resource Management and Intrapreneurship, University of Bayreuth, Bayreuth, Germany; Institute for Business Ethics, University of St. Gallen, St. Gallen, Switzerland","analytics; artificial intelligence (AI); dark side; Information Systems (IS); Patrick Mikalef, Aleš Popovic, Jenny Eriksson Lundström and Kieran Conboy; People analytics; peril",Artificial intelligence; Behavioral research; Human resource management; Information management; Information systems; Information use; Analytic; Artificial intelligence; Dark side; Data driven decision; Decisions makings; Human resource management practices; Information system; People analytic; Peril; Technological advances; Decision making,Literature review,Review,Human-AI interaction; analytics,Organization; individual,Global,Normative,None,Literature review,Theoretical,Human resources,0,0,0,1,Cognitivism,Implicit
Kordzadeh N.; Ghasemaghaei M.,"Algorithmic bias: review, synthesis, and future research directions",2022,European Journal of Information Systems,21,353,"As firms are moving towards data-driven decision making, they are facing an emerging problem, namely, algorithmic bias. Accordingly, algorithmic systems can yield socially-biased outcomes, thereby compounding inequalities in the workplace and in society. This paper reviews, summarises, and synthesises the current literature related to algorithmic bias and makes recommendations for future information systems research. Our literature analysis shows that most studies have conceptually discussed the ethical, legal, and design implications of algorithmic bias, whereas only a limited number have empirically examined them. Moreover, the mechanisms through which technology-driven biases translate into decisions and behaviours have been largely overlooked. Based on the reviewed papers and drawing on theories such as the stimulus-organism-response theory and organisational justice theory, we identify and explicate eight important theoretical concepts and develop a research model depicting the relations between those concepts. The model proposes that algorithmic bias can affect fairness perceptions and technology-related behaviours such as machine-generated recommendation acceptance, algorithm appreciation, and system adoption. The model also proposes that contextual dimensions (i.e., individual, task, technology, organisational, and environmental) can influence the perceptual and behavioural manifestations of algorithmic bias. These propositions highlight the significant gap in the literature and provide a roadmap for future studies. © Operational Research Society 2021.","Foisie School of Business, Worcester Polytechnic Institute, Worcester, United States; DeGroote School of Business, McMaster University, Hamilton, ON, Canada","ai ethics; algorithmic accountability; Algorithmic bias; algorithmic fairness; data analytics; Patrick Mikalef, Aleš Popovic, Jenny Eriksson Lundström and Kieran Conboy; responsible ai",Decision making; Environmental technology; Ethical technology; Ai ethic; Algorithmic accountability; Algorithmic bias; Algorithmic fairness; Algorithmics; Data analytics; Organisational; Responsible ai; Data Analytics,Literature review,Review,Ethical IS design,Organization; social,Global,Normative,Rawls; organizational justice,Literature review,Theoretical,Cross sectoral,0,0,0,1,Constructivism; Cognitivism; Naturalism,Implicit
Mikalef P.; Conboy K.; Lundström J.E.; Popovič A.,Thinking responsibly about responsible AI and ‘the dark side’ of AI,2022,European Journal of Information Systems,11,228,"Artificial Intelligence (AI) has been argued to offer a myriad of improvements in how we work and live. The notion of AI comprises a wide-ranging set of technologies that allow individuals and organizations to integrate and analyze data and use that insight to improve or automate decision-making. While most attention has been placed on the positive aspects companies realize by the adoption by the adoption and use of AI, there is a growing concern around the negative and unintended consequences of such technologies. In this special issue we have made a call for research papers that help us explore the dark side of AI use. By adopting a dark side lens, we aimed to expand our understanding of how AI should be implemented in practice, and how to minimize or avoid negative outcomes. In this editorial, we build on the notion of responsible AI, to highlight the different ways in which AI can potentially produce unintended consequences, as well as to suggest alternative paths future IS research can follow to improve our knowledge about how to mitigate such occurrences. We further expand on dark side theorizing in order to uncover hidden assumptions of current literature as well as to propose other prominent themes that can guide future IS research on AI adoption and use. © Operational Research Society 2022.","Department of Computer Science, Norwegian University of Science and Technology (NTNU), Norway; School of Business Economics, NUI Galway, Ireland; Department of Informatics and Media, Uppsala University, Uppsala, Sweden; School of Business Economics, NEOMA Business School, Mont-Saint-Aignan, France",AI Ethics; Artificial Intelligence; Dark side; Explainable AI; Responsible AI,,Editorial,Editorial,IS discipline,Social,Global,Normative,None; consequentalist; deontology,None,Theoretical,Cross sectoral,0,0,0,1,Anti-realism; Naturalism,Implicit
Jimenez A.; Abbott P.; Dasuki S.,In-betweenness in ICT4D research: critically examining the role of the researcher,2022,European Journal of Information Systems,14,17,"The ICT4D discipline has faced criticisms of an uneven production of knowledge that reinforces a dichotomy between Global North-Western knowledge systems on the one side, and Global South-indigenous-Southern knowledge systems on the other. As a result, some ICT4D literature has examined the role of the researcher in reinforcing these biases and further exacerbating inequalities, thus highlighting the complex relationship between ICT4D researchers and the research process. Yet, most of this literature has focused on an insider/outsider researcher positionality. This paper explores the role of the researcher from the alternative position of in-betweenness, where researchers adopt more fluid and dynamic positions as reflexive spaces. To do this, we engage in a dialogical process of retrospective reflections based on ICT4D projects in Nigeria, Peru and West Africa. Through these cases, we identify how we experience in-betweenness in distinct ways: as liminal spaces, as performative spaces, and as spaces of disjuncture. We also examine how these forms of in-betweenness informed our research. We demonstrate that a researcher positionality of in-betweenness in ICT4D research can increase awareness of nuanced researcher roles and potentially avoid ethical dilemmas and reproducing biases. © 2021 The Author(s). Published by Informa UK Limited, trading as Taylor & Francis Group.","Information School, University of Sheffield, United Kingdom","Global South; ICT4D; in-betweenness; insider/outsider; Irwin Brown, Kweku-Muata Osei-Bryson and Peter Meso; reflexivity; researcher",Betweenness; Complex relationships; Global south; ICT4D; ICT4D researches; In-betweenness; Insider/outsider; Knowledge system; Reflexivity; Research process,Empirical research,Article,IS discipline,Individual; social,Global south,Normative,Post-colonial ethics; critical IS,Critical interpretive analysis; case study,Theoretical; methodological,Research,0,0,0,0,Anti-realism,Implicit
Gal U.; Hansen S.; Lee A.S.,Research Perspectives: Toward Theoretical Rigor in Ethical Analysis: The Case of Algorithmic Decision-Making Systems,2022,Journal of the Association for Information Systems,27,19,"Algorithmic decision-making systems (ADMS) are increasingly being used by public and private organizations to enact decisions traditionally made by human beings across a broad range of domains, including business, law enforcement, education, and healthcare. Their growing prevalence engenders profound ethical challenges, which, we maintain, should be examined in a structured and theoretically informed fashion. However, much of the ethical exploration of ADMS within the IS field draws upon an atheoretical application of ethics. In this paper, we argue that the “big three” ethical theories of consequentialism, deontology, and virtue ethics can inform a structured comparative analysis of the ethical significance of ADMS. We demonstrate the value of such an approach through an illustrative case study of an ADMS in use by an Australian bank. Building upon this analysis, we address four characteristics of ADMS from the three theoretical perspectives, provide guidance on the contexts within which the application of each theory might be particularly fruitful, and highlight the advantages of theoretically grounded ethical analyses of ADMS. © 2022, Association for Information Systems. All rights reserved.","University of Sydney, Sydney, Australia; Rochester Institute of Technology, United States; Virginia Commonwealth University, United States",Algorithmic Decision-Making Systems; Consequentialism; Deontology; Ethical Analysis; Theoretical Rigor; Virtue Ethics,Ethical technology; Algorithmic decision-making system; Algorithmics; Consequentialism; Decision-making systems; Deontology; Ethical analyse; Private organizations; Public organizations; Theoretical rigor; Virtue ethics; Decision making,Research perspectives,Article,Ethical IS design,Organization; society,Australia,Normative,Consequentialism; deontology; virtue ethics,Conceptual analysis; case study,Theoretical; methodological,Cross sectoral,1,0,0,0,Cognitivism; Realism; Naturalism,Explicit
Heyder T.; Passlack N.; Posegga O.,Ethical management of human-AI interaction: Theory development review,2023,Journal of Strategic Information Systems,,50,"AI-based technologies have changed the nature of the symbiosis between humans and AI, and so strategic management of human-AI interaction in organizations requires deeper ethical considerations. Aligning AI with human values requires a systematic understanding of the ethical management of human-AI interaction. We conduct a theoretical review, from a sociotechnical perspective, and analyze ethical management of human-AI interaction through the lens of sociomateriality. Our systematic approach helps explain and clarify the interdependencies between two ethical perspectives – duty and virtue ethics – in sociotechnical systems. We also provide a theoretical framework that leads to seven avenues for future research. © 2023 The Author(s)","Information Systems and Social Networks, University of Bamberg, An der Weberei 5, Bamberg, 96047, Germany",Artificial intelligence; Ethics; Human-AI interaction; Sociomateriality; Theoretical review,Artificial intelligence; Ethical considerations; Human values; Human-AI interaction; Interaction theory; Socio materialities; Socio-technical perspective; Strategic management; Theoretical review; Theory development; Through the lens; Ethical technology,Research article,Review,Ethical IS design,Organization,Global,Normative,Deontology; virtue ethics,Conceptual analysis,Theoretical; research agenda,Cross sectoral,0,0,0,1,Underdetermined,Underdetermined
Marabelli M.; Newell S.,Responsibly strategizing with the metaverse: Business implications and DEI opportunities and challenges,2023,Journal of Strategic Information Systems,,45,"This viewpoint article aims to lay out the foundations for IS research on the strategic implications as well as diversity, equity, and inclusion (DEI) opportunities and challenges of the metaverse – a sociotechnical system providing users with an immersive, synchronous 3D experience of (virtual) reality through interoperable platforms and sensor devices. We first examine the metaverse's technologies and its underlying business models, which hold immense strategic implications for organizations and industries, and might require rethinking the future of work. As with most emerging technologies able to generate, collect, and process user data, the metaverse comes at a price; leveraging the metaverse strategically will require ethical and DEI considerations. After examining all these aspects of the metaverse, we reflect on ways IS scholarship engaged in strategizing can advance theoretical and practical knowledge by generating novel research questions and outlining a research agenda. Our contribution is twofold: first, we analyze the metaverse using a sociotechnical lens, thereby setting the ground for future studies of the phenomenon. Second, we identify specific strategic implications as well as DEI opportunities and challenges associated with the metaverse, and discuss how scholarship versed in IS strategizing can contribute to addressing them, both theoretically and empirically. © 2023 Elsevier B.V.","Bentley University, 175 Forest St., Waltham, 02122, MA, United States; Warwick Business School, Scarman Rd, Coventry, CV4 7AL, United Kingdom",DEI; Emerging technologies; Ethics; Interoperability; IS strategizing; Metaverse; Societal consequences; Sociotechnical systems,"Ethical technology; 3d experiences; Diversity, equity, and inclusion; Emerging technologies; Immersive; IS strategizing; Lay-out; Metaverses; Sensor device; Societal consequence; Sociotechnical systems; Interoperability",Viewpoint,Article,Ethical IS design,Organization; society,Global,Normative,None,Conceptual analysis,Theoretical; research agenda,Cross sectoral,0,0,0,1,Constructivism,Implicit
Tomalin M.,Rethinking online friction in the information society,2023,Journal of Information Technology,13,5,"A recurrent mantra of the technology industry is that all forms of ‘friction’ should be eliminated from online interactions (especially commercial transactions). In this context, ‘friction’ refers to any unnecessary retardation of a process or activity that delays the user accomplishing a desired action. This broad category can therefore include online adverts that link to the wrong webpages, pop-up windows that block access to content or delays in the physical delivery of an ordered item. Although visions of a frictionless future have been common since at least 1995 (the year Bill Gates popularised the phrase ‘friction-free capitalism’), the basic notion has remained unhelpfully vague. Accordingly, this article focuses specifically on the phenomenon of online friction (i.e. ‘e-friction’) and elaborates a typology of the main subtypes. An analytical framework of this kind makes it much easier to compare and contrast distinct kinds of e-friction, recognising that important differences distinguish those that are ‘elective’, ‘non-elective’, ‘impeding’, ‘distracting’ and so on. Having sketched a preliminary typology, the article reflects upon the ethical implications of the distinct varieties, and concludes by suggesting that there are several reasons why an entirely (e-)frictionless future is a profoundly disturbing one. © Association for Information Technology Trust 2022.","University of Cambridge, Cambridge, United Kingdom",friction; ICTs and society; information technology; online communications; social networking,Social networking (online); Social sciences computing; Commercial transactions; Ethical implications; ICT and society; Information society; On-line communication; Online interaction; Pop-up windows; Social-networking; Technology industry; Web-page; Friction,Research article,Article,Social media,Social,Global,Normative,Floridi's information ethics,Conceptual analysis,Theoretical; conceptual model,Social media,0,0,0,0,Realism; Non-naturalism,Implicit
Schlagwein D.; Willcocks L.,‘ChatGPT et al.’: The ethics of using (generative) artificial intelligence in research and science,2023,Journal of Information Technology,6,43,[No abstract available],"Business School, The University of Sydney, Sydney, NSW, Australia; Department of Management, The London School of Economics and Political Science, London, United Kingdom",,,Editorial,Editorial,IS discipline,Disciplinary,Global,Normative,Deontology; consequentialism,Conceptual analysis,Theoretical,Research,0,0,0,0,Cognitivism,Implicit
Lindman J.; Makinen J.; Kasanen E.,"Big Tech’s power, political corporate social responsibility and regulation",2023,Journal of Information Technology,15,28,"The economic dominance of large Internet tech companies, specifically the ‘Big Five’ (Google, Apple, Meta née Facebook, Amazon and Microsoft), is fundamentally complicating the organisation of society. Their positions raise profound questions, old and new, at the intersection of information systems and political philosophy, where companies have traditionally appeared in liberal democracies as economic operators rather than powerful political actors that threaten to limit citizens’ fundamental rights significantly through their operations. Importantly, the traditional understanding of corporate social responsibility is rooted in the liberal-democratic conception of moral labour’s division between public and private powers in a market economy. Focussing on this division, the paper analyses the various types of political power these companies wield and the complexities of regulating that power. Thus, it contributes to the IS discipline’s theoretical discussion by introducing political theory concepts that hold untapped potential for reconciling Big Tech and modern liberal-democratic conceptions of society. Taking these concepts as underpinnings for discussing six types of power, in turn (business vs. politics, democratic government, institutions of a market economy, companies, civil society and citizens), the paper offers the discipline example research questions to tackle and points to potential directions for scholarship. © Association for Information Technology Trust 2023.","Department of Applied IT, University of Gothenburg, Gothenburg, Sweden; Estonian Business School Tallinn, Tallinn, Estonia; Department of Management Studies, Aalto University School of Business, Espoo, Finland; Aalto University, Aalto, Finland",Big tech; corporate social responsibility (CSR); digitalization; ethics; fundamental rights; political theory,Economic and social effects; Social aspects; Big five; Big tech; Corporate social responsibility; Digitalization; Fundamental right; Market economies; Political theory; Power; Social regulations; Commerce,Research article,Article,Digitalization,Social,USA; EU,Normative,Rawlsian liberalism,Conceptual analysis,Theoretical,Technology,0,0,0,1,Realism; Cognitivism; Constructivism,Implicit
Nussbaumer A.; Pope A.; Neville K.,A framework for applying ethics-by-design to decision support systems for emergency management,2023,Information Systems Journal,21,22,"The development and utilisation of new information and communication technologies presents opportunities and risks, which bring ethical issues to the forefront. Any attempt to minimise the potential negative consequences to individuals, organisations and society resulting from the use of these technologies is challenging. In order to address these challenges, this paper presents an ethics-by-design approach that has been developed and implemented in the context of Decision Supports Systems for Emergency Management. Such systems help manage large and cross-border disasters by supporting decision makers to respond on emergencies in a reasonable way by taking follow-up actions into account. The approach taken in this paper specifically provides means to support the ethical dimensions of these decisions. Actions taken during disasters can have ramifications that persist long after a disaster has passed. The ethics-by-design approach presented here not only informs the design of systems, but also considers the role and training of the decision makers in the design process. The paper builds on the literature on ethics in information systems and makes a contribution to theory by providing a framework to ensure ethical considerations are embedded into the design of systems. © 2021 The Authors. Information Systems Journal published by John Wiley & Sons Ltd.","Institute of Interactive Systems and Data Science (ISDS), Graz University of Technology, Graz, Austria; Business Information Systems, University College Cork, Cork, Ireland",computer ethics; decision support; decision support systems; emergency management; ethics; ethics-by-design,Artificial intelligence; Civil defense; Decision making; Design; Disasters; Embedded systems; Ethical technology; Information management; Information systems; Information use; Risk management; Computer ethics; Cross-border; Decision makers; Decision supports; Design approaches; Development and utilizations; Emergency management; Ethic-by-design; Ethical issues; New information and communication technologies; Decision support systems,Research article,Article,IS implementation,Organization; social,Europe,Normative,Value sensitive design,Design science; case-based evaluation,Theoretical; conceptual model,Healthcare,0,0,0,1,Cognitivism; Subjectivism,Implicit
